{
  "$schema": "http://json-schema.org/draft-07/schema#",
  "type": ["object", "null"],
  "title": "Case Fan Schema",
  "description": "Schema for Case Fan components",
  "required": ["metadata"],
  "properties": {
    "opendb_id": {
      "type": ["string", "null"],
      "description": "Unique identifier for the document (UUID v4)"
    },
    "weight": {
      "description": "Product weight in grams for one complete, usable unit of this exact variant. Exclude retail packaging, shipping materials, multipack totals, and load capacity. Leave unset when the product is digital, the weight is unknown, or the source does not clearly identify product weight.",
      "type": ["number", "null"],
      "exclusiveMinimum": 0
    },
    "size": {
      "description": "The fan size in mm (e.g., 120)",
      "type": ["number", "null"]
    },
    "color": {
      "description": "The color(s) of this product. Each color of the product should be included in the array. Do not use RGB here to describe lighting; use the Lighting field for RGB, ARGB, display, or fixed-color lighting. The color of the fan frame and blades.",
      "type": ["array", "null"],
      "items": {
        "type": "string",
        "enum": [
          "BLACK",
          "WHITE",
          "RGB",
          "RED",
          "BLUE",
          "GREEN",
          "GREY",
          "YELLOW",
          "ORANGE",
          "PURPLE",
          "PINK",
          "BROWN",
          "GOLD"
        ]
      }
    },
    "lighting": {
      "description": "Lighting capabilities for this product. Use RGB for non-addressable RGB, ARGB for addressable RGB, Multicolor for non-RGB multi-color lighting, Fixed for a single fixed lighting color, None when the product has no lighting, Display for configurable displays, and Fixed Color Display for displays limited to fixed colors such as black and white.",
      "type": ["array", "null"],
      "items": {
        "type": "string",
        "enum": ["RGB", "ARGB", "Multicolor", "Fixed", "None", "Display", "Fixed Color Display"]
      }
    },
    "quantity": {
      "description": "Number of separately mountable fan units included in the package. Use the total number of fans only for multi-packs of separate fans. Single-frame multi-fan products count as 1 unit. Example: an NZXT F360-style 360mm single-frame triple-fan unit should use quantity 1, not 3.",
      "type": ["number", "null"]
    },
    "min_airflow": {
      "description": "The minimum airflow of the fan in CFM. If it is a constant, just fill in min_airflow and ignore max_airflow",
      "type": ["number", "null"]
    },
    "max_airflow": {
      "description": "The maximum airflow of the fan in CFM. If it is a constant, just fill in min_airflow and ignore max_airflow",
      "type": ["number", "null"]
    },
    "min_noise_level": {
      "description": "The minimum noise level of the fan in dB. If it is a constant, just fill in min_noise_level and ignore max_noise_level",
      "type": ["number", "null"]
    },
    "max_noise_level": {
      "description": "The maximum noise level of the fan in dB. If it is a constant, just fill in min_noise_level and ignore max_noise_level",
      "type": ["number", "null"]
    },
    "pwm": {
      "description": "Whether the fan supports Pulse Width Modulation for speed control",
      "type": ["boolean", "null"]
    },
    "led": {
      "description": "The type of LED lighting, if any (e.g., 'Addressable RGB', 'RGB', 'None')",
      "type": ["string", "null"],
      "enum": [
        "None",
        "Addressable RGB",
        "RGB",
        "Blue",
        "Red",
        "White",
        "Green",
        "Multicolor",
        "Orange",
        "Purple",
        "Pink",
        "ARGB",
        "Yellow",
        null
      ]
    },
    "connector": {
      "description": "The type of connector(s) the fan uses (e.g., '4-pin PWM + 3-pin 5V Addressable RGB')",
      "type": ["string", "null"]
    },
    "controller": {
      "description": "If the fan includes a controller, specify the type (e.g., '5V Addressable RGB'). Otherwise, indicate 'None'",
      "type": ["string", "null"]
    },
    "static_pressure": {
      "description": "The static pressure of the fan in mmH₂O",
      "type": ["number", "null"]
    },
    "flow_direction": {
      "description": "The direction of the airflow (e.g., 'Standard', 'Reverse')",
      "type": ["string", "null"],
      "enum": ["Standard", "Reverse", null]
    },
    "isOEM": {
      "description": "Whether this fan is OEM-only (bundled with cases, not sold separately)",
      "type": ["boolean", "null"]
    },
    "general_product_information": {
      "type": ["object", "null"],
      "description": "General product information and retailer SKUs",
      "properties": {
        "amazon_sku": {
          "type": ["string", "null"],
          "description": "Amazon product SKU"
        },
        "newegg_sku": {
          "type": ["string", "null"],
          "description": "Newegg product SKU"
        },
        "bestbuy_sku": {
          "type": ["number", "null"],
          "description": "Best Buy product SKU"
        },
        "walmart_sku": {
          "type": ["number", "null"],
          "description": "Walmart product SKU"
        },
        "adorama_sku": {
          "type": ["string", "null"],
          "description": "Adorama product SKU"
        },
        "ibuypower_sku": {
          "type": ["string", "null"],
          "description": "iBuyPower product SKU"
        },
        "hyte_sku": {
          "type": ["string", "null"],
          "description": "HYTE product SKU"
        },
        "lttstore_sku": {
          "type": ["string", "null"],
          "description": "LTTStore product SKU"
        },
        "manufacturer_url": {
          "type": ["string", "null"],
          "description": "Official manufacturer product URL"
        }
      }
    },
    "metadata": {
      "type": ["object", "null"],
      "properties": {
        "name": {
          "description": "Full product name",
          "type": ["string", "null"]
        },
        "manufacturer": {
          "description": "The company that produced the case fans.",
          "type": ["string", "null"]
        },
        "part_numbers": {
          "description": "Array of manufacturer's part numbers/SKUs",
          "type": ["array", "null"],
          "items": {
            "type": "string"
          }
        },
        "series": {
          "description": "Product series name The manufacturer's marketed product line / family for the fan. Manufacturer is stored separately; `size`, `quantity` (pack count), `manufacturer_color`, `pwm`, `led`, and `connector` are also separate fields and MUST NOT be in the series. The series name often encodes the size (e.g., `NF-A12x25` is a 120mm family) because the manufacturer markets the same family with different SKUs per size — keep the size in the series name when the manufacturer's SKU does. Examples: 'Noctua NF-A12x25 PWM 120mm' → series='NF-A12x25'. 'Lian Li UNI Fan SL120 V2 3-Pack' → series='UNI Fan SL'. 'Corsair iCUE LINK QX120 RGB Triple Pack' → series='iCUE LINK QX120'. The series stays consistent across pack-size / color / PWM SKUs of the same product line.",
          "type": ["string", "null"]
        },
        "variant": {
          "description": "Specific variant in the series Most fans should have an empty variant. Pack quantity, fan size, color, PWM, LED, connector, and flow direction are all stored in their own fields. Only fill `variant` when the manufacturer ships a genuinely distinct sub-model under the same series name that is NOT already captured by another field. Examples: 'Arctic P12 PWM PST 5-Pack' → variant='PST' (PST = PWM Sharing Technology, not captured by `pwm`). 'Lian Li UNI Fan SL120 V2 3-Pack' → variant='V2' (a marketed hardware revision sold next to the V1 SKU). 'Corsair iCUE LINK QX120 RGB Starter Kit' → variant='Starter Kit' (the bundle SKU is sold separately). The variant must be unique within a (manufacturer, series, size, manufacturer_color, quantity) group; if every fan collapses to the same value, leave it empty.",
          "type": ["string", "null"]
        },
        "releaseYear": {
          "description": "Year of release",
          "type": ["number", "null"]
        },
        "manufacturer_color": {
          "description": "Manufacturer's official color name for this product variant. The manufacturer's marketed colorway / frame finish name, verbatim. Common values: 'Black', 'White', 'Black / White'. Multi-tone fans use ' / '. Branded special / collab colorways belong here when the rest of the SKU is identical (e.g., 'Hatsune Miku Edition'). Noctua's signature colorways ('Brown / Beige', 'chromax.black', 'chromax.black.swap') also go here. Most stock fans are 'Black'. Do NOT put fan size, pack count, PWM, PST, RGB, ARGB, or family / model words like 'NF-A12x25', 'P12', 'UNI Fan' in manufacturer_color — those belong in dedicated fields or the series.",
          "type": ["string", "null"]
        },
        "last_manually_spec_verified_at": {
          "type": ["string", "null"],
          "format": "date-time",
          "description": "ISO 8601 timestamp of when the part specs were last manually verified by a human"
        }
      },
      "required": ["name"]
    },
    "identifiers": {
      "type": "object",
      "properties": {
        "version": {
          "type": "integer",
          "exclusiveMinimum": 0,
          "maximum": 9007199254740991,
          "description": "Monotonically increasing identity snapshot version"
        },
        "identifiers": {
          "type": "array",
          "items": {
            "type": "object",
            "properties": {
              "type": {
                "type": "string",
                "enum": ["upc", "ean", "gtin", "mpn"]
              },
              "value": {
                "type": "string",
                "minLength": 1
              },
              "region": {
                "default": "all",
                "type": "string",
                "minLength": 1
              }
            },
            "required": ["type", "value", "region"],
            "additionalProperties": false
          },
          "description": "Canonical product identifiers"
        },
        "retailer_listings": {
          "type": "array",
          "items": {
            "type": "object",
            "properties": {
              "source": {
                "type": "string",
                "minLength": 1
              },
              "channel": {
                "type": "string",
                "minLength": 1
              },
              "source_product_id": {
                "type": "string",
                "minLength": 1
              },
              "pricing_enabled": {
                "type": "boolean"
              },
              "excluded_source_offer_ids": {
                "type": "array",
                "items": {
                  "type": "string",
                  "minLength": 1,
                  "maxLength": 512
                }
              },
              "verified": {
                "type": "boolean"
              }
            },
            "required": ["source", "channel", "source_product_id", "pricing_enabled", "verified"],
            "additionalProperties": false
          },
          "description": "Canonical retailer product listings used for pricing"
        }
      },
      "required": ["version", "identifiers", "retailer_listings"],
      "additionalProperties": false,
      "description": "Current versioned product identity snapshot used for retailer and pricing matching"
    }
  }
}
