{
  "opendb_id": "3c6c2af8-3a1d-4b66-ab0f-17a3ce357811",
  "size": 120,
  "color": ["BLACK"],
  "lighting": [],
  "quantity": 3,
  "min_airflow": 40.9,
  "max_airflow": null,
  "min_noise_level": 25,
  "max_noise_level": null,
  "pwm": true,
  "led": "RGB",
  "connector": "Proprietary PWM",
  "controller": "USB",
  "static_pressure": 1.4,
  "flow_direction": "Standard",
  "isOEM": false,
  "metadata": {
    "name": "Thermaltake Riing Quad 120mm Black PWM RGB TT Premium Edition 3-Pack",
    "manufacturer": "Thermaltake",
    "part_numbers": ["CL-F088-PL12SW-B"],
    "series": "Riing",
    "variant": "120mm Black"
  },
  "general_product_information": {},
  "identifiers": {
    "version": 1,
    "identifiers": [
      {
        "type": "ean",
        "value": "0841163073933",
        "region": "all"
      },
      {
        "type": "mpn",
        "value": "CL-F088-PL12SW-B",
        "region": "all"
      },
      {
        "type": "upc",
        "value": "841163073933",
        "region": "all"
      }
    ],
    "retailer_listings": [
      {
        "source": "amazon",
        "channel": "au",
        "source_product_id": "B083FMF6G6",
        "pricing_enabled": true,
        "verified": true
      },
      {
        "source": "amazon",
        "channel": "be",
        "source_product_id": "B083FMF6G6",
        "pricing_enabled": true,
        "verified": true
      },
      {
        "source": "amazon",
        "channel": "ca",
        "source_product_id": "B083FMF6G6",
        "pricing_enabled": true,
        "verified": true
      },
      {
        "source": "amazon",
        "channel": "de",
        "source_product_id": "B083FMF6G6",
        "pricing_enabled": true,
        "verified": true
      },
      {
        "source": "amazon",
        "channel": "es",
        "source_product_id": "B083FMF6G6",
        "pricing_enabled": true,
        "verified": true
      },
      {
        "source": "amazon",
        "channel": "fr",
        "source_product_id": "B083FMF6G6",
        "pricing_enabled": true,
        "verified": true
      },
      {
        "source": "amazon",
        "channel": "ie",
        "source_product_id": "B083FMF6G6",
        "pricing_enabled": true,
        "verified": true
      },
      {
        "source": "amazon",
        "channel": "it",
        "source_product_id": "B083FMF6G6",
        "pricing_enabled": true,
        "verified": true
      },
      {
        "source": "amazon",
        "channel": "jp",
        "source_product_id": "B083FMF6G6",
        "pricing_enabled": true,
        "verified": true
      },
      {
        "source": "amazon",
        "channel": "nl",
        "source_product_id": "B083FMF6G6",
        "pricing_enabled": true,
        "verified": true
      },
      {
        "source": "amazon",
        "channel": "pl",
        "source_product_id": "B083FMF6G6",
        "pricing_enabled": true,
        "verified": true
      },
      {
        "source": "amazon",
        "channel": "se",
        "source_product_id": "B083FMF6G6",
        "pricing_enabled": true,
        "verified": true
      },
      {
        "source": "amazon",
        "channel": "sg",
        "source_product_id": "B083FMF6G6",
        "pricing_enabled": true,
        "verified": true
      },
      {
        "source": "amazon",
        "channel": "uk",
        "source_product_id": "B083FMF6G6",
        "pricing_enabled": true,
        "verified": true
      },
      {
        "source": "amazon",
        "channel": "us",
        "source_product_id": "B083FMF6G6",
        "pricing_enabled": true,
        "verified": true
      },
      {
        "source": "bhphoto",
        "channel": "us",
        "source_product_id": "THCLF088PL12",
        "pricing_enabled": true,
        "verified": false
      },
      {
        "source": "newegg",
        "channel": "ca",
        "source_product_id": "N82E16835106624",
        "pricing_enabled": true,
        "verified": false
      },
      {
        "source": "newegg",
        "channel": "us",
        "source_product_id": "N82E16835106624",
        "pricing_enabled": true,
        "verified": false
      },
      {
        "source": "walmart",
        "channel": "us",
        "source_product_id": "668283863",
        "pricing_enabled": true,
        "verified": false
      }
    ]
  }
}
