{
  "opendb_id": "439ed69e-fdb6-4373-a1db-9508107e312a",
  "size": 140,
  "color": ["BLACK"],
  "lighting": [],
  "quantity": 2,
  "min_airflow": 15,
  "max_airflow": 82.9,
  "min_noise_level": 10,
  "max_noise_level": 31.8,
  "pwm": true,
  "led": "Addressable RGB",
  "connector": "4-pin PWM + 3-pin 5V Addressable RGB",
  "controller": "5V Addressable RGB",
  "static_pressure": 2.06,
  "flow_direction": "Standard",
  "isOEM": false,
  "metadata": {
    "name": "Corsair iCUE ML RGB ELITE Premium 140mm Black PWM Addressable RGB 82.9 CFM 2-Pack",
    "manufacturer": "Corsair",
    "part_numbers": [],
    "series": "iCUE",
    "variant": "140mm Black"
  },
  "general_product_information": {},
  "identifiers": {
    "version": 1,
    "identifiers": [],
    "retailer_listings": []
  }
}
