{
  "opendb_id": "65cf9afd-83f7-423a-95dc-3aa775c1f0a0",
  "metadata": {
    "name": "In Win Neptune DN140 88.89 CFM 140 mm Fan",
    "manufacturer": "In Win",
    "series": "Neptune",
    "variant": "140mm Black"
  },
  "size": 140,
  "color": "Black",
  "quantity": 1,
  "min_airflow": 41.67,
  "max_airflow": 88.89,
  "min_noise_level": 24.5,
  "max_noise_level": null,
  "pwm": true,
  "led": "None",
  "connector": "4-pin PWM",
  "controller": "None",
  "static_pressure": 2.18,
  "flow_direction": "Standard",
  "general_product_information": {}
}