{
  "opendb_id": "4ab587b4-640f-4e88-be85-14ec7a539d5c",
  "size": 120,
  "color": ["BLACK"],
  "lighting": [],
  "quantity": 1,
  "min_airflow": null,
  "max_airflow": null,
  "min_noise_level": null,
  "max_noise_level": null,
  "pwm": true,
  "led": "Addressable RGB",
  "connector": "4-pin PWM + 3-pin 5V Addressable RGB",
  "controller": "None",
  "static_pressure": null,
  "flow_direction": "Standard",
  "isOEM": false,
  "metadata": {
    "name": "SilentiumPC Fluctus 120mm Black PWM ARGB",
    "manufacturer": "SilentiumPC",
    "part_numbers": [],
    "series": "Fluctus",
    "variant": "120mm Black"
  },
  "general_product_information": {},
  "identifiers": {
    "version": 1,
    "identifiers": [],
    "retailer_listings": []
  }
}
