{
  "opendb_id": "7a364b07-d143-485e-9469-d82e3f7b962f",
  "size": 120,
  "color": ["WHITE"],
  "lighting": [],
  "quantity": 5,
  "min_airflow": null,
  "max_airflow": null,
  "min_noise_level": null,
  "max_noise_level": null,
  "pwm": false,
  "led": "Addressable RGB",
  "connector": "Proprietary",
  "controller": "5V Addressable RGB",
  "static_pressure": null,
  "flow_direction": "Standard",
  "isOEM": false,
  "metadata": {
    "name": "darkFlash CF8 Pro 120mm Transparent Addressable RGB 5-Pack",
    "manufacturer": "darkFlash",
    "part_numbers": [],
    "series": "CF8",
    "variant": "120mm Transparent"
  },
  "general_product_information": {},
  "identifiers": {
    "version": 1,
    "identifiers": [],
    "retailer_listings": []
  }
}
