{
  "opendb_id": "0b630d49-b6cb-4081-8090-c71dccf888da",
  "size": 120,
  "color": ["BLACK"],
  "lighting": ["None"],
  "quantity": 1,
  "min_airflow": 37.85,
  "max_airflow": null,
  "min_noise_level": 23,
  "max_noise_level": null,
  "pwm": true,
  "led": "None",
  "connector": "4-pin PWM",
  "controller": "None",
  "static_pressure": 3.1,
  "flow_direction": "Standard",
  "isOEM": false,
  "metadata": {
    "name": "Corsair SP120 Quiet 120mm Black PWM 1-Pack",
    "manufacturer": "Corsair",
    "part_numbers": [],
    "series": "SP120",
    "variant": "Quiet",
    "manufacturer_color": "Black"
  },
  "general_product_information": {},
  "identifiers": {
    "version": 1,
    "identifiers": [],
    "retailer_listings": []
  }
}
