{
  "opendb_id": "8e6042c3-6829-4f19-bb09-a0acacb30092",
  "metadata": {
    "name": "Thermaltake Pure 67.02 CFM 140 mm Fan",
    "manufacturer": "Thermaltake",
    "series": "Pure",
    "variant": "140mm Black"
  },
  "size": 140,
  "color": "Black",
  "quantity": 1,
  "min_airflow": 67.02,
  "max_airflow": null,
  "min_noise_level": 20,
  "max_noise_level": null,
  "pwm": false,
  "led": "None",
  "connector": "3-pin",
  "controller": "None",
  "static_pressure": null,
  "flow_direction": "Standard",
  "general_product_information": {}
}