{
  "opendb_id": "a34c5b4e-af1d-4712-9442-f3940dc5ed81",
  "size": 140,
  "color": ["BLACK", "WHITE"],
  "lighting": [],
  "quantity": 2,
  "min_airflow": 62,
  "max_airflow": null,
  "min_noise_level": 26,
  "max_noise_level": null,
  "pwm": false,
  "led": "Blue",
  "connector": "3-pin",
  "controller": "None",
  "static_pressure": null,
  "flow_direction": "Standard",
  "isOEM": false,
  "metadata": {
    "name": "Corsair AF140 (2018) 140mm Black / White Blue 62 CFM 2-Pack",
    "manufacturer": "Corsair",
    "part_numbers": [],
    "series": "AF140",
    "variant": "140mm Black / White"
  },
  "general_product_information": {},
  "identifiers": {
    "version": 1,
    "identifiers": [],
    "retailer_listings": []
  }
}
