{
  "opendb_id": "84123d6f-ed0b-404b-b450-5a5e04b5cdaa",
  "size": 120,
  "color": ["BLACK", "WHITE"],
  "lighting": [],
  "quantity": 10,
  "min_airflow": 57.67,
  "max_airflow": null,
  "min_noise_level": 24.7,
  "max_noise_level": null,
  "pwm": false,
  "led": "None",
  "connector": "3-pin",
  "controller": "None",
  "static_pressure": 1.66,
  "flow_direction": "Standard",
  "isOEM": false,
  "metadata": {
    "name": "Apevia 12S 120mm Black / White 57.67 CFM 10-Pack",
    "manufacturer": "Apevia",
    "part_numbers": [],
    "series": "12S",
    "variant": "120mm Black / White"
  },
  "general_product_information": {},
  "identifiers": {
    "version": 1,
    "identifiers": [],
    "retailer_listings": []
  }
}
