{
  "opendb_id": "5e1eefbc-565d-4efb-be6f-d94706dbd372",
  "metadata": {
    "name": "Enermax UCHF12PARGB-W-BP3 72.1 CFM 120mm Fans 3-Pack",
    "manufacturer": "Enermax",
    "series": "UCHF12PARGB-W-BP3",
    "variant": "120mm White"
  },
  "size": 120,
  "color": [
    "WHITE"
  ],
  "quantity": 3,
  "min_airflow": 22.5,
  "max_airflow": 72.1,
  "min_noise_level": 14,
  "max_noise_level": 27,
  "pwm": true,
  "led": "Addressable RGB",
  "connector": "4-pin PWM",
  "controller": "5V Addressable RGB",
  "static_pressure": 1.98,
  "flow_direction": "Standard",
  "general_product_information": {}
}