{
  "opendb_id": "68ec97e0-2b12-44cc-bcd8-8126705b1c28",
  "size": 140,
  "color": ["BLACK"],
  "lighting": [],
  "quantity": 1,
  "min_airflow": 20,
  "max_airflow": 97,
  "min_noise_level": 16,
  "max_noise_level": 37,
  "pwm": true,
  "led": "None",
  "connector": "4-pin PWM",
  "controller": "None",
  "static_pressure": null,
  "flow_direction": "Standard",
  "isOEM": false,
  "metadata": {
    "name": "Corsair ML140 Pro 140mm Black PWM",
    "manufacturer": "Corsair",
    "part_numbers": ["CO-9050045-WW"],
    "series": "ML140",
    "variant": "140mm Black"
  },
  "general_product_information": {},
  "identifiers": {
    "version": 1,
    "identifiers": [
      {
        "type": "ean",
        "value": "7429501991953",
        "region": "all"
      },
      {
        "type": "mpn",
        "value": "CO-9050045-WW",
        "region": "all"
      },
      {
        "type": "upc",
        "value": "843591072151",
        "region": "all"
      }
    ],
    "retailer_listings": [
      {
        "source": "amazon",
        "channel": "au",
        "source_product_id": "B01G5I6MW0",
        "pricing_enabled": true,
        "verified": true
      },
      {
        "source": "amazon",
        "channel": "be",
        "source_product_id": "B01G5I6MW0",
        "pricing_enabled": true,
        "verified": true
      },
      {
        "source": "amazon",
        "channel": "ca",
        "source_product_id": "B01G5I6MW0",
        "pricing_enabled": true,
        "verified": true
      },
      {
        "source": "amazon",
        "channel": "de",
        "source_product_id": "B01G5I6MW0",
        "pricing_enabled": true,
        "verified": true
      },
      {
        "source": "amazon",
        "channel": "es",
        "source_product_id": "B01G5I6MW0",
        "pricing_enabled": true,
        "verified": true
      },
      {
        "source": "amazon",
        "channel": "fr",
        "source_product_id": "B01G5I6MW0",
        "pricing_enabled": true,
        "verified": true
      },
      {
        "source": "amazon",
        "channel": "ie",
        "source_product_id": "B01G5I6MW0",
        "pricing_enabled": true,
        "verified": true
      },
      {
        "source": "amazon",
        "channel": "it",
        "source_product_id": "B01G5I6MW0",
        "pricing_enabled": true,
        "verified": true
      },
      {
        "source": "amazon",
        "channel": "jp",
        "source_product_id": "B01G5I6MW0",
        "pricing_enabled": true,
        "verified": true
      },
      {
        "source": "amazon",
        "channel": "nl",
        "source_product_id": "B01G5I6MW0",
        "pricing_enabled": true,
        "verified": true
      },
      {
        "source": "amazon",
        "channel": "pl",
        "source_product_id": "B01G5I6MW0",
        "pricing_enabled": true,
        "verified": true
      },
      {
        "source": "amazon",
        "channel": "se",
        "source_product_id": "B01G5I6MW0",
        "pricing_enabled": true,
        "verified": true
      },
      {
        "source": "amazon",
        "channel": "sg",
        "source_product_id": "B01G5I6MW0",
        "pricing_enabled": true,
        "verified": true
      },
      {
        "source": "amazon",
        "channel": "uk",
        "source_product_id": "B01G5I6MW0",
        "pricing_enabled": true,
        "verified": true
      },
      {
        "source": "amazon",
        "channel": "us",
        "source_product_id": "B01G5I6MW0",
        "pricing_enabled": true,
        "verified": true
      },
      {
        "source": "walmart",
        "channel": "us",
        "source_product_id": "165825523",
        "pricing_enabled": true,
        "verified": false
      }
    ]
  }
}
