{
  "opendb_id": "d55f7875-9b81-46ca-9e1e-0d60c4271814",
  "size": 120,
  "color": ["WHITE"],
  "lighting": [],
  "quantity": 1,
  "min_airflow": 44,
  "max_airflow": null,
  "min_noise_level": 17,
  "max_noise_level": null,
  "pwm": false,
  "led": "None",
  "connector": "3-pin",
  "controller": "None",
  "static_pressure": null,
  "flow_direction": "Standard",
  "isOEM": false,
  "metadata": {
    "name": "Enermax Marathon 120mm Clear 1-Pack",
    "manufacturer": "Enermax",
    "part_numbers": [],
    "series": "Marathon",
    "variant": "120mm Clear"
  },
  "general_product_information": {},
  "identifiers": {
    "version": 1,
    "identifiers": [],
    "retailer_listings": []
  }
}
