{
  "opendb_id": "0a4765b3-ef24-4c17-a9df-1d58fd07730d",
  "metadata": {
    "name": "NZXT FZ 59.1 CFM 120mm",
    "manufacturer": "NZXT",
    "series": "FZ",
    "variant": "120mm Clear"
  },
  "size": 120,
  "color": [
    "WHITE"
  ],
  "quantity": 1,
  "min_airflow": 59.1,
  "max_airflow": null,
  "min_noise_level": 26.8,
  "max_noise_level": null,
  "pwm": false,
  "led": "Blue",
  "connector": "3-pin",
  "controller": "None",
  "static_pressure": null,
  "flow_direction": "Standard",
  "general_product_information": {}
}