{
  "opendb_id": "72c97e47-2d6e-4970-8d8b-87f805435a51",
  "size": 120,
  "color": ["WHITE"],
  "lighting": ["ARGB"],
  "quantity": 3,
  "min_airflow": 58,
  "min_noise_level": 27.2,
  "pwm": true,
  "led": "Addressable RGB",
  "connector": "4-pin PWM",
  "controller": "None",
  "static_pressure": 1.94,
  "flow_direction": "Standard",
  "isOEM": false,
  "metadata": {
    "name": "ID-COOLING AS-120-W Trio Pack of 3 White PWM",
    "manufacturer": "ID-COOLING",
    "part_numbers": ["AS-120-W"],
    "series": "AS",
    "variant": "120-W",
    "releaseYear": 2025,
    "manufacturer_color": "White"
  },
  "general_product_information": {
    "manufacturer_url": "https://www.idcooling.com/product/detail?id=519#gallery"
  },
  "identifiers": {
    "version": 1,
    "identifiers": [
      {
        "type": "mpn",
        "value": "AS-120-W",
        "region": "all"
      }
    ],
    "retailer_listings": []
  }
}
