{
  "opendb_id": "77eb0637-3929-44af-9d47-7b445ade25d3",
  "size": 140,
  "color": ["WHITE", "BROWN"],
  "lighting": ["None"],
  "quantity": 3,
  "min_airflow": 102.3,
  "max_airflow": 119.6,
  "min_noise_level": 31.6,
  "max_noise_level": 34.1,
  "pwm": true,
  "led": "None",
  "connector": "4-pin PWM",
  "controller": "None",
  "static_pressure": 3.57,
  "flow_direction": "Standard",
  "isOEM": false,
  "metadata": {
    "name": "Thermaltake TOUGHFAN EX14 Pro 119.6 CFM 140mm White PWM 3-Pack",
    "manufacturer": "Thermaltake",
    "part_numbers": [],
    "series": "TOUGHFAN EX Pro",
    "variant": "Default",
    "manufacturer_color": "White",
    "last_manually_spec_verified_at": "2026-01-14T19:15:32.378Z"
  },
  "general_product_information": {
    "manufacturer_url": "https://www.thermaltake.com/toughfan-ex14-pro-high-static-pressure-pc-cooling-fan-white-swappable-edition-3-fan-pack.html"
  },
  "identifiers": {
    "version": 1,
    "identifiers": [
      {
        "type": "ean",
        "value": "0841163094853",
        "region": "all"
      },
      {
        "type": "ean",
        "value": "4711475644847",
        "region": "all"
      },
      {
        "type": "mpn",
        "value": "CL-F172-PL14WT-A",
        "region": "all"
      },
      {
        "type": "upc",
        "value": "841163094853",
        "region": "all"
      }
    ],
    "retailer_listings": [
      {
        "source": "alternate",
        "channel": "de",
        "source_product_id": "100082801",
        "pricing_enabled": true,
        "verified": false
      },
      {
        "source": "alternate",
        "channel": "es",
        "source_product_id": "100082801",
        "pricing_enabled": true,
        "verified": false
      },
      {
        "source": "alternate",
        "channel": "fr",
        "source_product_id": "100082801",
        "pricing_enabled": true,
        "verified": false
      },
      {
        "source": "alternate",
        "channel": "it",
        "source_product_id": "100082801",
        "pricing_enabled": true,
        "verified": false
      },
      {
        "source": "amazon",
        "channel": "au",
        "source_product_id": "B0DJDMF88P",
        "pricing_enabled": true,
        "verified": true
      },
      {
        "source": "amazon",
        "channel": "be",
        "source_product_id": "B0DJDMF88P",
        "pricing_enabled": true,
        "verified": true
      },
      {
        "source": "amazon",
        "channel": "ca",
        "source_product_id": "B0DJDMF88P",
        "pricing_enabled": true,
        "verified": true
      },
      {
        "source": "amazon",
        "channel": "de",
        "source_product_id": "B0DJDMF88P",
        "pricing_enabled": true,
        "verified": true
      },
      {
        "source": "amazon",
        "channel": "es",
        "source_product_id": "B0DJDMF88P",
        "pricing_enabled": true,
        "verified": true
      },
      {
        "source": "amazon",
        "channel": "fr",
        "source_product_id": "B0DJDMF88P",
        "pricing_enabled": true,
        "verified": true
      },
      {
        "source": "amazon",
        "channel": "ie",
        "source_product_id": "B0DJDMF88P",
        "pricing_enabled": true,
        "verified": true
      },
      {
        "source": "amazon",
        "channel": "it",
        "source_product_id": "B0DJDMF88P",
        "pricing_enabled": true,
        "verified": true
      },
      {
        "source": "amazon",
        "channel": "jp",
        "source_product_id": "B0DJDMF88P",
        "pricing_enabled": true,
        "verified": true
      },
      {
        "source": "amazon",
        "channel": "nl",
        "source_product_id": "B0DJDMF88P",
        "pricing_enabled": true,
        "verified": true
      },
      {
        "source": "amazon",
        "channel": "pl",
        "source_product_id": "B0DJDMF88P",
        "pricing_enabled": true,
        "verified": true
      },
      {
        "source": "amazon",
        "channel": "se",
        "source_product_id": "B0DJDMF88P",
        "pricing_enabled": true,
        "verified": true
      },
      {
        "source": "amazon",
        "channel": "sg",
        "source_product_id": "B0DJDMF88P",
        "pricing_enabled": true,
        "verified": true
      },
      {
        "source": "amazon",
        "channel": "uk",
        "source_product_id": "B0DJDMF88P",
        "pricing_enabled": true,
        "verified": true
      },
      {
        "source": "amazon",
        "channel": "us",
        "source_product_id": "B0DJDMF88P",
        "pricing_enabled": true,
        "verified": true
      },
      {
        "source": "cenowarka",
        "channel": "pl",
        "source_product_id": "3362162",
        "pricing_enabled": true,
        "verified": false
      },
      {
        "source": "geizhals",
        "channel": "de",
        "source_product_id": "3362162",
        "pricing_enabled": true,
        "verified": false
      },
      {
        "source": "mwave",
        "channel": "au",
        "source_product_id": "AC80934",
        "pricing_enabled": true,
        "verified": false
      },
      {
        "source": "newegg",
        "channel": "ca",
        "source_product_id": "1YF-001G-004D4",
        "pricing_enabled": true,
        "verified": true
      },
      {
        "source": "newegg",
        "channel": "us",
        "source_product_id": "1YF-001G-004D4",
        "pricing_enabled": true,
        "verified": true
      },
      {
        "source": "proshop",
        "channel": "de",
        "source_product_id": "3500111",
        "pricing_enabled": true,
        "verified": false
      },
      {
        "source": "proshop",
        "channel": "fi",
        "source_product_id": "3500111",
        "pricing_enabled": true,
        "verified": false
      },
      {
        "source": "proshop",
        "channel": "nl",
        "source_product_id": "3500111",
        "pricing_enabled": true,
        "verified": false
      },
      {
        "source": "proshop",
        "channel": "pl",
        "source_product_id": "3500111",
        "pricing_enabled": true,
        "verified": false
      },
      {
        "source": "skinflint",
        "channel": "uk",
        "source_product_id": "3362162",
        "pricing_enabled": true,
        "verified": false
      }
    ]
  }
}
