{
  "opendb_id": "ece45046-8f71-4325-9b81-d75551d014a9",
  "metadata": {
    "name": "Fractal Design Prisma AL 63.33 CFM 140 mm Fan",
    "manufacturer": "Fractal Design",
    "series": "Prisma",
    "variant": "140mm White / Black"
  },
  "size": 140,
  "color": "White / Black",
  "quantity": 1,
  "min_airflow": 63.33,
  "max_airflow": null,
  "min_noise_level": 19.4,
  "max_noise_level": null,
  "pwm": false,
  "led": "Addressable RGB",
  "connector": "3-pin + 3-pin 5V Addressable RGB",
  "controller": "None",
  "static_pressure": 1.07,
  "flow_direction": "Standard",
  "general_product_information": {}
}