{
  "opendb_id": "652558e4-a5c3-467a-bc25-a3813a0b22d8",
  "metadata": {
    "name": "ARCTIC P12 Slim PWM PST 42.1 CFM 120 mm Fans 3-Pack",
    "manufacturer": "ARCTIC",
    "series": "P12",
    "variant": "120mm Black"
  },
  "size": 120,
  "color": [],
  "quantity": 3,
  "min_airflow": 42.1,
  "max_airflow": null,
  "min_noise_level": 22.5,
  "max_noise_level": null,
  "pwm": true,
  "led": "None",
  "connector": "4-pin PWM",
  "controller": "None",
  "static_pressure": 1.45,
  "flow_direction": "Standard",
  "general_product_information": {
    "newegg_sku": "9SIA1K6JHK8227",
    "walmart_sku": 2351123310
  }
}