{
  "opendb_id": "2a2c3c29-c626-4255-8ecd-c940609d57c1",
  "metadata": {
    "name": "ID-COOLING AS-120 120mm 58 CFM",
    "manufacturer": "ID-COOLING",
    "series": "AS-120",
    "variant": "120mm Black"
  },
  "size": 120,
  "color": [
    "BLACK"
  ],
  "quantity": 1,
  "min_airflow": 58,
  "max_airflow": null,
  "min_noise_level": 27.2,
  "max_noise_level": null,
  "pwm": true,
  "led": "None",
  "connector": "4-pin PWM",
  "controller": "None",
  "static_pressure": 1.94,
  "flow_direction": "Standard",
  "general_product_information": {}
}