{
  "opendb_id": "880d0737-1568-42bf-886d-19b12d877c1e",
  "size": 120,
  "quantity": 1,
  "pwm": false,
  "connector": "3-pin DC",
  "flow_direction": "Standard",
  "isOEM": true,
  "metadata": {
    "name": "Zalman Raven OEM Quiet Fan",
    "manufacturer": "Zalman"
  },
  "general_product_information": {},
  "identifiers": {
    "version": 1,
    "identifiers": [],
    "retailer_listings": []
  }
}
