{
  "opendb_id": "c8c0ecc7-f086-4741-9851-7b99b4c9eb2b",
  "size": 140,
  "color": ["WHITE"],
  "lighting": ["None"],
  "quantity": 1,
  "min_airflow": 110,
  "max_airflow": null,
  "min_noise_level": null,
  "max_noise_level": null,
  "pwm": true,
  "led": "None",
  "connector": "4-pin PWM",
  "controller": "None",
  "static_pressure": 5.2,
  "flow_direction": "Standard",
  "isOEM": false,
  "metadata": {
    "name": "ARCTIC P14 Pro PST 140mm White PWM PST",
    "manufacturer": "ARCTIC",
    "part_numbers": ["ACFAN00317A"],
    "series": "P14",
    "variant": "Pro PST",
    "releaseYear": 2025,
    "manufacturer_color": "White"
  },
  "general_product_information": {
    "manufacturer_url": "https://www.arctic.de/en/P14-Pro-PST-White/ACFAN00317A"
  },
  "identifiers": {
    "version": 1,
    "identifiers": [
      {
        "type": "ean",
        "value": "0728434199359",
        "region": "all"
      },
      {
        "type": "ean",
        "value": "0840033403085",
        "region": "all"
      },
      {
        "type": "ean",
        "value": "4895265000416",
        "region": "all"
      },
      {
        "type": "mpn",
        "value": "ACFAN00317A",
        "region": "all"
      },
      {
        "type": "upc",
        "value": "728434199359",
        "region": "all"
      },
      {
        "type": "upc",
        "value": "840033403085",
        "region": "all"
      }
    ],
    "retailer_listings": [
      {
        "source": "aaawave",
        "channel": "us",
        "source_product_id": "51748169417025",
        "pricing_enabled": true,
        "verified": false
      },
      {
        "source": "alternate",
        "channel": "de",
        "source_product_id": "100147032",
        "pricing_enabled": true,
        "verified": false
      },
      {
        "source": "alternate",
        "channel": "es",
        "source_product_id": "100147032",
        "pricing_enabled": true,
        "verified": false
      },
      {
        "source": "alternate",
        "channel": "fr",
        "source_product_id": "100147032",
        "pricing_enabled": true,
        "verified": false
      },
      {
        "source": "alternate",
        "channel": "it",
        "source_product_id": "100147032",
        "pricing_enabled": true,
        "verified": false
      },
      {
        "source": "amazon",
        "channel": "au",
        "source_product_id": "B0DPX6D61P",
        "pricing_enabled": true,
        "verified": true
      },
      {
        "source": "amazon",
        "channel": "be",
        "source_product_id": "B0DPX6D61P",
        "pricing_enabled": true,
        "verified": true
      },
      {
        "source": "amazon",
        "channel": "ca",
        "source_product_id": "B0DPX6D61P",
        "pricing_enabled": true,
        "verified": true
      },
      {
        "source": "amazon",
        "channel": "de",
        "source_product_id": "B0DPX6D61P",
        "pricing_enabled": true,
        "verified": true
      },
      {
        "source": "amazon",
        "channel": "es",
        "source_product_id": "B0DPX6D61P",
        "pricing_enabled": true,
        "verified": true
      },
      {
        "source": "amazon",
        "channel": "fr",
        "source_product_id": "B0DPX6D61P",
        "pricing_enabled": true,
        "verified": true
      },
      {
        "source": "amazon",
        "channel": "ie",
        "source_product_id": "B0DPX6D61P",
        "pricing_enabled": true,
        "verified": true
      },
      {
        "source": "amazon",
        "channel": "it",
        "source_product_id": "B0DPX6D61P",
        "pricing_enabled": true,
        "verified": true
      },
      {
        "source": "amazon",
        "channel": "jp",
        "source_product_id": "B0DPX6D61P",
        "pricing_enabled": true,
        "verified": true
      },
      {
        "source": "amazon",
        "channel": "nl",
        "source_product_id": "B0DPX6D61P",
        "pricing_enabled": true,
        "verified": true
      },
      {
        "source": "amazon",
        "channel": "pl",
        "source_product_id": "B0DPX6D61P",
        "pricing_enabled": true,
        "verified": true
      },
      {
        "source": "amazon",
        "channel": "se",
        "source_product_id": "B0DPX6D61P",
        "pricing_enabled": true,
        "verified": true
      },
      {
        "source": "amazon",
        "channel": "sg",
        "source_product_id": "B0DPX6D61P",
        "pricing_enabled": true,
        "verified": true
      },
      {
        "source": "amazon",
        "channel": "uk",
        "source_product_id": "B0DPX6D61P",
        "pricing_enabled": true,
        "verified": true
      },
      {
        "source": "amazon",
        "channel": "us",
        "source_product_id": "B0DPX6D61P",
        "pricing_enabled": true,
        "verified": true
      },
      {
        "source": "back-to-the-office",
        "channel": "uk",
        "source_product_id": "56246706897278",
        "pricing_enabled": true,
        "verified": false
      },
      {
        "source": "caseking",
        "channel": "de",
        "source_product_id": "LUAR-142",
        "pricing_enabled": true,
        "verified": false
      },
      {
        "source": "caseking",
        "channel": "es",
        "source_product_id": "ACFAN00317A",
        "pricing_enabled": true,
        "verified": false
      },
      {
        "source": "cenowarka",
        "channel": "pl",
        "source_product_id": "3552675",
        "pricing_enabled": true,
        "verified": false
      },
      {
        "source": "geizhals",
        "channel": "de",
        "source_product_id": "3552675",
        "pricing_enabled": true,
        "verified": false
      },
      {
        "source": "globaldata",
        "channel": "pt",
        "source_product_id": "ACFAN00317A",
        "pricing_enabled": true,
        "verified": false
      },
      {
        "source": "jimms-pc",
        "channel": "fi",
        "source_product_id": "212659",
        "pricing_enabled": true,
        "verified": false
      },
      {
        "source": "neobyte",
        "channel": "es",
        "source_product_id": "VN01AI49",
        "pricing_enabled": true,
        "verified": false
      },
      {
        "source": "proshop",
        "channel": "de",
        "source_product_id": "3358497",
        "pricing_enabled": true,
        "verified": false
      },
      {
        "source": "proshop",
        "channel": "fi",
        "source_product_id": "3358497",
        "pricing_enabled": true,
        "verified": false
      },
      {
        "source": "proshop",
        "channel": "nl",
        "source_product_id": "3358497",
        "pricing_enabled": true,
        "verified": false
      },
      {
        "source": "proshop",
        "channel": "pl",
        "source_product_id": "3358497",
        "pricing_enabled": true,
        "verified": false
      },
      {
        "source": "quzo",
        "channel": "uk",
        "source_product_id": "410354",
        "pricing_enabled": true,
        "verified": false
      },
      {
        "source": "ruedecommerce",
        "channel": "fr",
        "source_product_id": "AR202507240022",
        "pricing_enabled": true,
        "verified": false
      },
      {
        "source": "scan-computer",
        "channel": "uk",
        "source_product_id": "163264",
        "pricing_enabled": true,
        "verified": false
      },
      {
        "source": "skinflint",
        "channel": "uk",
        "source_product_id": "3552675",
        "pricing_enabled": true,
        "verified": false
      },
      {
        "source": "walmart",
        "channel": "us",
        "source_product_id": "17806970091",
        "pricing_enabled": true,
        "verified": true
      }
    ]
  }
}
