{
  "opendb_id": "db8e36ed-d198-4058-9b0e-fd7111cf5110",
  "metadata": {
    "name": "ID-COOLING SF-12025-W 62 CFM 120 mm Fan",
    "manufacturer": "ID-COOLING",
    "series": "SF-12025-W",
    "variant": "120mm White"
  },
  "size": 120,
  "color": "White",
  "quantity": 1,
  "min_airflow": 62,
  "max_airflow": null,
  "min_noise_level": 18,
  "max_noise_level": 26.4,
  "pwm": true,
  "led": "White",
  "connector": "4-pin PWM",
  "controller": "None",
  "static_pressure": 1.78,
  "flow_direction": "Standard",
  "general_product_information": {}
}