{
  "opendb_id": "1770cfb7-f4af-4f54-a28c-7ee9aa0701df",
  "metadata": {
    "name": "Corsair SP140 49.49 CFM 140 mm",
    "manufacturer": "Corsair",
    "series": "SP140",
    "variant": "140mm Black / Purple"
  },
  "size": 140,
  "color": [],
  "quantity": 1,
  "min_airflow": 49.49,
  "max_airflow": null,
  "min_noise_level": 29.3,
  "max_noise_level": null,
  "pwm": false,
  "led": "Purple",
  "connector": "3-pin",
  "controller": "None",
  "static_pressure": null,
  "flow_direction": "Standard",
  "general_product_information": {}
}