{
  "opendb_id": "08b5a97c-c2c5-406b-9c23-66577ea05ae7",
  "size": 120,
  "color": [],
  "lighting": ["ARGB"],
  "quantity": 1,
  "pwm": true,
  "connector": "4-pin PWM",
  "flow_direction": "Standard",
  "isOEM": false,
  "metadata": {
    "name": "ASUS ROG RYUO IV MF-12C ARGB Fan OEM Design2",
    "manufacturer": "ASUS",
    "part_numbers": [],
    "series": "ROG RYUO IV MF-12C",
    "manufacturer_color": "Black"
  },
  "general_product_information": {},
  "identifiers": {
    "version": 1,
    "identifiers": [],
    "retailer_listings": []
  }
}
