{
  "opendb_id": "19649635-57ee-4cb5-a990-a1bd83c334ab",
  "size": 120,
  "color": ["WHITE"],
  "lighting": [],
  "quantity": 1,
  "min_airflow": 0,
  "max_airflow": 58.09,
  "min_noise_level": 0,
  "max_noise_level": 21.2,
  "pwm": true,
  "led": "Addressable RGB",
  "connector": "4-pin PWM + 3-pin 5V Addressable RGB",
  "controller": "None",
  "static_pressure": 1.802,
  "flow_direction": "Standard",
  "isOEM": false,
  "metadata": {
    "name": "NoiseBlocker NB-ELOOP X 120mm White ARGB PWM 58.09 CFM 1-Pack",
    "manufacturer": "NoiseBlocker",
    "part_numbers": ["ITR-B12X-PS"],
    "series": "NB-ELOOP",
    "variant": "120mm White"
  },
  "general_product_information": {},
  "identifiers": {
    "version": 1,
    "identifiers": [
      {
        "type": "ean",
        "value": "4250051906547",
        "region": "all"
      },
      {
        "type": "mpn",
        "value": "ITR-B12X-PS",
        "region": "all"
      }
    ],
    "retailer_listings": [
      {
        "source": "amazon",
        "channel": "au",
        "source_product_id": "B083KD41KC",
        "pricing_enabled": true,
        "verified": true
      },
      {
        "source": "amazon",
        "channel": "be",
        "source_product_id": "B083KD41KC",
        "pricing_enabled": true,
        "verified": true
      },
      {
        "source": "amazon",
        "channel": "ca",
        "source_product_id": "B083KD41KC",
        "pricing_enabled": true,
        "verified": true
      },
      {
        "source": "amazon",
        "channel": "de",
        "source_product_id": "B083KD41KC",
        "pricing_enabled": true,
        "verified": true
      },
      {
        "source": "amazon",
        "channel": "es",
        "source_product_id": "B083KD41KC",
        "pricing_enabled": true,
        "verified": true
      },
      {
        "source": "amazon",
        "channel": "fr",
        "source_product_id": "B083KD41KC",
        "pricing_enabled": true,
        "verified": true
      },
      {
        "source": "amazon",
        "channel": "ie",
        "source_product_id": "B083KD41KC",
        "pricing_enabled": true,
        "verified": true
      },
      {
        "source": "amazon",
        "channel": "it",
        "source_product_id": "B083KD41KC",
        "pricing_enabled": true,
        "verified": true
      },
      {
        "source": "amazon",
        "channel": "jp",
        "source_product_id": "B083KD41KC",
        "pricing_enabled": true,
        "verified": true
      },
      {
        "source": "amazon",
        "channel": "nl",
        "source_product_id": "B083KD41KC",
        "pricing_enabled": true,
        "verified": true
      },
      {
        "source": "amazon",
        "channel": "pl",
        "source_product_id": "B083KD41KC",
        "pricing_enabled": true,
        "verified": true
      },
      {
        "source": "amazon",
        "channel": "se",
        "source_product_id": "B083KD41KC",
        "pricing_enabled": true,
        "verified": true
      },
      {
        "source": "amazon",
        "channel": "sg",
        "source_product_id": "B083KD41KC",
        "pricing_enabled": true,
        "verified": true
      },
      {
        "source": "amazon",
        "channel": "uk",
        "source_product_id": "B083KD41KC",
        "pricing_enabled": true,
        "verified": true
      },
      {
        "source": "amazon",
        "channel": "us",
        "source_product_id": "B083KD41KC",
        "pricing_enabled": true,
        "verified": true
      },
      {
        "source": "back-to-the-office",
        "channel": "uk",
        "source_product_id": "55424980320638",
        "pricing_enabled": true,
        "verified": false
      },
      {
        "source": "caseking",
        "channel": "de",
        "source_product_id": "LUNO-079",
        "pricing_enabled": true,
        "verified": false
      },
      {
        "source": "cenowarka",
        "channel": "pl",
        "source_product_id": "2191769",
        "pricing_enabled": true,
        "verified": false
      },
      {
        "source": "geizhals",
        "channel": "de",
        "source_product_id": "2191769",
        "pricing_enabled": true,
        "verified": false
      },
      {
        "source": "overclockers",
        "channel": "uk",
        "source_product_id": "FG-06A-NB",
        "pricing_enabled": true,
        "verified": false
      },
      {
        "source": "skinflint",
        "channel": "uk",
        "source_product_id": "2191769",
        "pricing_enabled": true,
        "verified": false
      }
    ]
  }
}
